quote	source
Remember this one thing baby girl, women don’t juggle…we diversify!	Iesha S. Walker, Seasons
If you want to be a writer-- stop talking about it! Sit down and write. -Jackie Collins	Roberta  Wilson
Fate bring two people togetherand it is love's job t o keep them there.	Juvy Ann, String of Fate
String of fate brings two people together and it is love's job to keep them there.	Juvy Ann, String of Fate
If erotic writing is the objectification of sex, then reading is its subjectification.	Mark John Isola
Sometimes just getting through each day requires almost superhuman strength.	Jojo Moyes, After You
Then maybe you’ll believe me when I say…you’re pretty fucking special, Laney Hill.	Cassia Leo, Anti-Romance
Eventually, you're gonna have to let someone in.	Cassia Leo, Anti-Romance
Forgiveness is a gift you give yourself.	Cassia Leo, Anti-Romance
You said my name and my heart went rogue	Zandile, Constantly Racing
Blake gave Selena a nudge "Remember what I taught you, itsy-bitsy-babe	A.E.  Kirk
Everyone has a monster inside	J.G. Faherty
When you come to a detour, take it.	Jack Dancer, Detour Paris
There is nothing so sexy as a good-looking man in a good-looking pair of shorts.	H.L. Sudler, Summerville
Please don’t forget me, don’t let me fade away… I was here, I lived, and I loved…	Dannielle Wicks, Fading Away
Being an author, writing a book was great fun. Publishing and marketing, not so fun.	Wynne Stevens
The gossip will kill your Great Grandmother.	Linda  Joyce, Bayou Born
... The use of your gift for good is your responsibility. You must decide for yourself.	Thomas Sweeney, The Harem
The destruction of something beautiful can appear so entertaining.	Thomas Sweeney, The Harem
We are one.	Thomas Sweeney, The Harem
Why not?	Howard Feigenbaum
Fictional people are people, too, otherwise why would we care what happens to them?	Nora Roberts, The Collector
Pain is an inevitable part when you truly love.	Vinsfortin, The Promise
Love, is an unknown passion, for an unknown person, for an unknown reason.	Hamza Hassan Sheikh
She probably fell asleep and was washed away by the tortoise waves!”-Arista	Khalia Hades, Ariel's Demise
I don’t want to look. I’ve got to look.” Vance... "Vital Perception	D.L. Given
You’ll be civilized or we’ll leave your arse here.” Johan... "Vital Perception	D.L. Given, Vital Perception
When reading dies, the imagination soon follows.	Ronnie Ray Jenkins
All the real secrets are buried, and only ghosts speak the truth.	Anthony Hyde, The Red Fox
Never give up. Dare to Dream. Dare to believe.	Stacey T. Hunt
To be inspired is great, but to inspire is an honor.	Stacey T. Hunt
If the shining sun blinds the eye,it makes sense. But to be blinded by gold and silver!	I.R. Shankar
It's a good day to do great things!	Randy Lipnitzky, Dark Hero
I heart my job. I get to make things up for a living.	Michelle M. Pillow
If you think my waistline defines my worth, you are not worth my time anyways.	Maria Elena, Eternal Youth
I can be badass and still like pedicures." - Liz Harper, Secret Need	Satin Russell, Secret Need
I love my own kind—womankind.	Qiu Miaojin
Love is described like GOD.	Sara Pascoe
I’m using beauty to subvert the system.	Georgia Clark, The Regulars
What do you think Amy Poehler is doing right now?	Georgia Clark, The Regulars
There’s no such thing as ugly.	Georgia Clark, The Regulars
I am all things, I am not your words. I am defined by me.	Maria Elena, Eternal Youth
The trick about falling is to catch yourself before you hit the dirt.	William  Ritter
You can be brave and still be feminine. You can lead and still love flowers.	Kiera Cass, The Heir
Take my heart and squeeze it out over the face of Your Bride, the Church.	Catherine of Siena
The greatest form of abortion is not letting the man put it there in the first place!	Onuoha Adanma
The worth of a society is genuine if established on cardinal law of kingdom–love	Sunday Adelaja
The underprivileged are byproduct of society’s material progress.	Pawan Mishra
If a society does not value love and kindness, that society has no value.	Debasish Mridha
Everyone is the right person for the right person.	Raheel Farooq
Love is the magic gluethat holds us together!	Allan Rufus
Love is a wild child, always at odds with society.	Marty Rubin
Fear is a disease of mind we inherit from society.	Debasish Mridha
Our society needs to restablish a culture of swag.	Batuhan Ibal
War has no winners and peace, no losers	Ashok  Kallarakkal
Humans are one, not divided, but multiplied into many.	Raheel Farooq
In a materialistic society, there’s no such a thing as a ‘romantic’ broke man.	Mokokoma Mokhonoana
Love is the light by which all are brought forward out of darkness.	LeeAnn Taylor
To embrace love, we risk heartbreak. To resist love, we risk emptiness.	Jennifer Lane, Aced
Letting go of the past, is like opening the flood gates of healing to be set free.	Asa Don Brown
The benefits of forgiveness are limitless.	Asa Don Brown
I have never been sad because my losses are my profits	Praveen KC
Perfectionism is adaptive if you are mindful of your humanhood.	Asa Don Brown
You can’t get a reaction from someone who doesn’t give a shit.	Emma Chase, Tangled
Let others see their own greatness when looking in your eyes.	Mollie Marti
You embody the strength of 10,000 moons and your life will be a testament of it. Ase	Kierra C.T. Banks
Our lives are the Journey we take to find our true selves!	Alyssa Gonzalez
Would he ever have the strength to stop looking?	J.K. Rowling
Strength is wearing a smile even when you are wailing inside!	Deeba Salim Irfan
Build your strength in love.	Lailah Gifty Akita
Love is the greatest personal force.	Lailah Gifty Akita
The power of love is the strength for the heart.	Lailah   Gifty Akita
Sometimes I fear the strength of Love.!	
No matter what happens, I will always love myself.	Gabriela M. Sanchez
Freedom does not come withterms and conditionsDon't let anyone eversell you that.	Anjum Choudhary
If it's not on the table, don't eat it off the floor.	Melody Carstairs
You do not need any more strength. You need only to realize how strong you already are.	Vironika Tugaleva
Being alone is better than being your whore.	Lori Jenessa Nelson
Your heart is yours to give, it is no ones to take. Not a queen. Not a prince. No one.	Stormy Smith, Bound by Duty
I have a thing for things that last.	Criss Jami, Killosophy
Persistence is the source of great strength.	Debasish Mridha
Often we read to strengthen our beliefs but not to think.	Debasish Mridha
You matter. You're not broken. You're stronger than you think.	Vironika Tugaleva
Love is An invited deal for losing peace	Seema Gupta
Divine love""Don't Leave me, ONLYTo carry my body on my two feet I need you	Seema Gupta
I was surprise to see the world didn't stop just cause my boy did.	Kathryn Stockett, The Help
I did not need him to survive. He inspired me to find that strength in myself.	Chrissy Moon, Surreal Ecstasy
If you can get life outta love, you should die trying to get love outta life.	Shane Rainey
The worst disability in life is a bad attitude.	SupaNova Slom
How I wish you could have known me in my strength.	Marilynne Robinson, Gilead
The strength of a woman far exceeds the brawn of a man. ~Lisa Antonio	Lisa Antonio
One second she’s all timid, and then reeoowr! Hellcat.	Carrie Butler, Strength
Unconditional love, is love, regardless anything; attainable or impossible.	Anthony Liccione
All because I fell in love with a madman.	Carrie Butler, Strength
My hopes for pie died on the sidewalk. There went my grin.	Carrie Butler, Strength
The more loving we can be, the more powerful we become.	Silvia Hartmann
i want to be stronger, so i can protect what i love more.	Hiroko Sakai
When it comes to living and loving, we're all amateurs.	Marty Rubin
Live your life in such a way that you can say "I love my life" and really mean it.	TemitOpe Ibrahim
One day you will be the only one in the room not living.	Darnell Lamont Walker
There is no loss in life. The only loss is the love did not express.	Lailah Gifty Akita
Live each day with great love, hope and faith.	Lailah Gifty Akita
I build my life with light, love and loyalty.	Lailah Gifty Akita
Learning is essential for living the life you love.	A.D. Posey
Never stop loving while living, when you stop loving, you stop living.	Kemi Sogunle
The most amazing thing that makes life worth living is your love.	Debasish Mridha
Within Eros, there is (the) promise; within Love there is (the) Truth.	Noetis
Living in the past is like choosing to cling to a chronic illness.	Asa Don Brown
Best way to clear the air is to have it all out in the open.	Harper Lee
Become faithful to yourself, if you do, it will come natural towards everyone else.	Unarine Ramaru
A death without being a loss to anybody is the most unworthy death.	Alireza Salehi Nejad
With limited money you can survive, with more money you can live.	Amit Kalantri
Learn to live together with other people	Lailah Gifty Akita
Never cry for the same person twice.	Manoj Vaz
Between hope and despair treads a life without love!	Manoj Vaz
When it's about your life, it's time to be selfish.	Dee Dee Artner
In my sleep I have my nightmares, awake I have my thoughts, I am not sure which is worse.	Carl R. White
My Favourite hobby is to sit still and convert oxygen into Carbon Dioxide. Love to Live.	Brahmananda Patra
No matter what, you can only live this moment.	Krishna Sagar
You are message to the world make it motivating.	Nadair Desmar
In every living thing there is the desire for love.	D.H. Lawrence
Lighten up on yourself. No one is perfect. Gently accept your humanness.	Deborah Day
I wish you self-esteem so high – you're humble.	Lalah Delia
Find something you love and follow it back to loving yourself.	Benjamin Aubrey Myers
As I create I become.	Efrat Cybulkiewicz
I do not care if nobody resembles me.	Efrat Cybulkiewicz
Sufism expresses what I have found to be Real.	Efrat Cybulkiewicz
A fire is born long before its first flame.	Angelos Michalopoulos
Value yourself first and only then you can learn to value others.	Charlyn Khater
Drink your Desires to taste your self!	AnkitMishra
Your identity is not in who you can be. It is in who you always have been	Ricky Maye
Self worth comes from loving yourself and not from what others may think of you.	Karon Waddell
Someone smells good, it automatically makes them more attractive.	Hannah Q. Mensah
A soul`s ugliness can be much more ambitious than her beauty.	Michalopoulos Angelos
Cheating on self, is a paralysis of being.	Unarine Ramaru
I am fanatic book lover.	Lailah Gifty Akita
Do we find ourself or does our self get demolished?	Donna Goddard
Devote yourself to reading.	Lailah Gifty Akita
Nothing great can be achieved without great love.	Debasish Mridha
In order to love others I need to be full of it myself	Odille Rault
We are meant to do the work of angels for we are often disguised from ourSelves.	Paresh Shah
The day you subscribe to being loved by everyone is the day you stop growing.	Mr Imbuya
Self love and forgiveness is a liberation.	Lailah Gifty Akita
Love yourself,love your uniqueness. You are the only person can be true to yourself.	Lailah Gifty Akita
Be yourself, be brave.	Lailah Gifty Akita
Nobody's better than you and you're no better than anybody.	Mary Mihalic, Made to Make It
Personality can either kill or enhance your appearance.	Mary Mihalic, Made to Make It
Try as you may, you can never defy love.	Emery Lee, The Highest Stakes
As much as they were right for each other, time wasn't right for them.	Parul Wadhwa, The Masquerade
The love is in the waiting...	Tiffany Reisz, Poinsettia
Meeting her was luck.Knowing her was maddening.Loving her is destiny.	Ravikant Mahto
This was it, he knew it, was sure of it, this was the door which would take him back—	Stephen King, The Waste Lands
No one is sent by accident to anyone.	Juvy Ann, String of Fate
Fate bring two people together and it is love's job to keep them there	Juvy Ann, String of Fate
Our eyes met and our souls caught on fire.	Nikki Rowe
Carve your own adventure, bloom your own romance, thread your own signs	Noor Iskandar
On paper it's perfect.But the thing about paper is: It burns.	Cat Patrick, Just Like Fate
I can feel it, logic is trying to distract me but my heart it's screaming it's him.	Nikki Rowe
Something about him feels like forever…	Jennifer Elisabeth
For the first time in a long time I've met a man that makes my heart want to stay.	Nikki Rowe
I asked the universe for serendipity and you walked through my door.	Nikki Rowe
Everything is a part of destiny’s plan and I believe true love awaits its destiny.	Sara Naveed, Undying Affinity
All I ever wanted is you, Miss Zarish,” he said while pulling her closer to himself.	Sara Naveed, Undying Affinity
HeDestiny is very jealous FOR TRUE LOVE	Arshdeep Singh Samrala
Think with your eyes open.	Shelly Crane
Insanity, thy name is woman	Virginia Alison, Heaven Scent
Love is waiting, just around the corner, over the hill...	Virginia Alison
Romance this moment, this hour, this day. String moments together like pearls on a rope.	Rachelle Du Bois
I have no other destiny than the destiny of humanity.	Debasish Mridha
I guess there's always a price to pay when you cheat fate.	Sheena Hutchinson, Initiation
I write letters to you that you’ll never see.	Jennifer Elisabeth
The Fall will always be yours and mine…	Jennifer Elisabeth
Time' is the most threatening four letter word.	Jennifer Elisabeth
I’m tired of justifying why I love someone. I’m done with the explaining.	Jennifer Elisabeth
If I had an .MP3 of your heartbeat… I might actually get some sleep.	Jennifer Elisabeth
I wish that love could be broken down the way it breaks me down.	Jennifer Elisabeth
You can`t change destinies already written, that only happens in fairy tales.	Katie McGarry, Dare You To
Where Destiny sets its path,Fate shall follow...:	Deborah Ann
Do you believe that we have the ability to change destiny?	Michelle Madow, Remembrance
Find creative ways to express your love.	Iman Refaat
The ecstasy of love is a paradise.	Lailah Gifty Akita
Living a life full of wonder provides for a wonderful life.	Monika Zands
The Hands create, what the Heart feels!	courtland kusmierz
Do not fear mistakes, there are none.	Miles Davis
He was humbled by her infinite love toward him - it shone through even in his afterlife.	H. L. Balcomb
Failure taught him that he could have made the right choice. I could have tried.	H. L. Balcomb
wear your treasure and you will be Treasured	Treasure Stitches
Love the writing, love the writing, love the writing... the rest will follow.	Jane Yolen
Choose to put yourself first and make you a priority. It's not selfish, it's necessary.	Keysha Jade
The first purpose of your life is to find the purpose of your life.	Raaz Ojha
Some people are just like snake, they will never understand your love.	Raaz Ojha
To have mercy and truth requires love, good understanding and respect.	Auliq Ice
The graceful wings of a dove lead to the endless imagination in a dream wings of pain.	Auliq Ice
The unchangeable price of everything more precious and valuable is blood.	Auliq Ice
I can't see the future. But when I dreamed of the future, he was the one I was tied to.	Nancy Straight, Blood Debt
Future will forgive us but are you ready to forgive your past?	J. Limbu
Forget the Past. Doubt the Future. Love the Present.	Broken
It is where you want to be in the next five years, not where you are now.	Shannon L. Alder
Stop falling for those who won't raise you up in the future.	Michael Bassey Johnson
You were reserved for my future	Henry James
Hope, love and faith are in the waiting.	Dean Koontz, Odd Interlude #1
Not a day goes by, without thinking, that books are our future, not technology.	Arianna Ruby
The future will be bright, if you play it right!	Debasish Mridha
The future of a country doesn't depend on its wealth but on its education.	Debasish Mridha
I read to know the past, I write to express my love for the future.	Debasish Mridha
If you want to be happy in the future, be happy now.	Debasish Mridha
This world belongs to our future generations, so we have to take utmost care of it.	Debasish Mridha
Don't ask about my past. And never expect a future.	Colleen Hoover, Ugly Love
Don't Stress About the Future. Live Life and Love Now!	Anthony Avina
Hope:Belief in a bright future.	Lailah Gifty Akita
Don't let the lies of yesterday hamper the promises of tomorrow	Ricky Yousuf
Every broken heart has one time or another asked, "What is important to me now?	Shannon L. Alder
We all have scars & deep pain. It'swhat makes us human & vulnerable.	Anshuma Sharma
I want something that is nothing like the past.	Brooke Bida
Next time!" In what calendar are kept the records of those next times which never come?	Helen Hunt Jackson, Ramona
Belief, hard work, love–you have those things, you can do anything.	Mitch Albom, For One More Day
Skepticism precludes one from believing many things, but not from loving many things.	Marty Rubin
I don't believe in love. I love.	Marty Rubin
She glanced at me brieflyI looked at her longingly,so she believed Finally relieved.	Sumrit Shahi, Just Friends
Love is so many things, but it is not safe.	Shannon L. Alder
Belief, hard work, love - you have those things, you can do anything.	Mitch Albom, For One More Day
The warrior guided by the spirit serves humanity, the warrior without, serves the ego	Soke Behzad Ahmadi
Even in the broken state, my mind find waysto connect with you.	Anjum Choudhary
True love is like ghosts which many believe in, but few have seen.	François de La Rochefoucauld
We are but a speck in the Universe Oh, but what a lucky speck to be...	Kehinde Sonola
There is much to discover that's not on the back cover!	E.A. Bucchianeri
He who writes to his beloved every day, is not a lover, but a writer.	Dr. Kyaciss Pfiell
Of everythingI have ever endured,YOUareMy Favourite Tragedy.	Meraaqi, Divine Trouble
Starving artist: starving for affection, starving for attention	Jessica-Lynn Barbour, Willow
In literature, as in love, one can only speak for himself.	Andrew Lang
And I, a twister, love, what I abhor.	John Wain
Your words... I hold them deeplike ancient skinshold wrinkles.	Sanober  Khan
A chronic poet should always be an inveterate nature-lover.	Munia Khan
I never thought I'd fall madly in love with literature.	Wency June Libot
Why fear death? It is the most beautiful adventure in life.	Charles Frahman
I don't write poems to melt your heart.I write them,so our heartscan melt together.	Subhan Zein
He will understand when it is too late that it is easier to love.	Dejan Stojanovic, The Shape
I fly through memory to find a newborn love.	Dejan Stojanovic
To dream on occasion is not dreaming, To love on occasion is not love.	Dejan Stojanovic
There is no born lover, There is no born Don Juan, For we are all lovers.	Dejan Stojanovic
Love is almost never simple.	Dejan Stojanovic
How to put this feeling, this certainty, into something as limited as words?	Eileen Wilks, On the Prowl
Paint me perfect poetry.	N'Zuri Za Austin
It cost nothing to be nice.	Anonymous, but I'll claim it.
I am a lover of words.If your words don't play with me,nothing else in you will.	Wordions
Sometimes you just have to choose to let things go, to move on.	Anna Todd, After We Collided
Is love always like this? Is it always so passionate, yet so damn painful?	Anna Todd, After We Collided
Love writes without words.	A.D. Posey
Words are whips in the wind traveling between lovers.	Faith Tilley Johnson
Sometimes we don't get second chances. Sometimes things just end.	Colleen Hoover, Confess
The weight of your words is more important than the volume of your voice!	Manprit Kaur
A single poemis worth a hundredcozy winter nightskind wordsand healed wounds.	Sanober  Khan
Everything that drowned me taught me how to swim.	Jenim Dibie
Poetry keeps mein a highly drunken stateof divinity.	Sanober  Khan
She said, 'It is filled with all the words for how I want you.	Sarah Waters, Fingersmith
i am alwaysstalking you, my dear. with my thoughtsmy words.my breath.	Sanober  Khan
some words bring warmthjust bybeing next to each other.	Sanober  Khan
When words lose the value... nothing is left!	honeya
Words only make sense when someone who says them does.	Christian Rwynn
When our thoughts, our words, and our deeds are for happiness then we are happy.	Debasish Mridha
-Why are you so sad? - Because you speak to me in words and I look at you with feelings.	Leo Tolstoy
Eye contact is way more intimate than words will ever be.	Faraaz Kazi
What is the finding of love, but a voice answering a voice?	D. Antoinette Foy
Love is wind for the soul	D. Antoinette Foy
Silent words are heard through eyes.	Vikrmn, 10 Alone
And empty words are evil.	Homer, The Odyssey
I love the words, because they love me too.	M.F. Moonzajer
Why do you have to be so damn cryptic?	Amanda Hocking, Switched
They said a lot of things to each other that night, but nothing that involved words.	Michael  Grant
...perhaps in actions I'm less of a man - but, oh the words - such lovely words...	John Geddes, A Familiar Rain
Fucking fixes nothing, but certain feelings are unavoidable.	Kris Kidd, Return to Sender
You can't quell depression by making love. But we tried. But we tried, oh, we did.	Yrsa Daley-Ward, bone
Traveling down a road of self-destructionWith no room for any reconstruction	Jessica-Lynn Barbour
I remember all the things we said we'd doAnd how not a single thing we said was true	Jessica-Lynn Barbour
Love is like a knife. It can either hurt you or it's too dangerous to hold on too.	PureDragonWolf
My lips have touched more bottles than lovers and I'm half a shot away from psychotic.	Denice Envall
Get a shot of love to prevent the infection called depression.	Debasish Mridha
I lost myself in the burden of trying to be your savior.	Alexandria Hampton
I always fill the chat box, almost every day, and end up deleting my heart.	Esteban Urayoán
When your heart is broken, it’s easier to follow rules	Betsy Cornwell, Mechanica
Being in home is like magic moments, in a magic world, among magicians.	Durgesh Satpathy
We had a threesomeYou, me and my depressionDepression fucks hard	Benedict Smith
She could have risen from the ashes. Instead, she smoldered in the embers.	Thinking Out Loud
She(my love) said to me, what's the matter with you?.......I replied.....'NOTHING	Anuj Kr. Thakur
You haunt my days and dreams.	Jennifer Elisabeth
When I recall memories, it all seems like a film, not a reality.	Rukhsar Din
I want to re-start my life,	pavankumar nagaraj
Better live than dead.	Touaxia Vang
Selfish love hurts, selfless love heals.	Rob Liano
You will never attain and maintain more than you think you deserve.	Rob Liano
You cannot move forward if you are always thinking backwards	Bathsheba Dailey
Never take the first brick out of the wall unless you know it is meant to fall	Bathsheba Dailey
I thought I was dreaming and I dreamed.	Марко Соколовић
The 3 most powerful resources you have available to you : love, prayer and forgiveness.	H. Jackson Brown Jr.
Best gifts: love, prayer, books!	Lailah Gifty Akita
Prayer is pouring your heart to the one you love.	Sunday Adelaja
May your home always be filled with love, laughter and happiness.	Debasish Mridha
I have only one prayer and that is, “Please give me endless power to love.	Debasish Mridha
May your life be a fountain of love and kindness to fill the world with joy.	Debasish Mridha M.D.
Miracles have a higher percentage of being permanent than magical solutions.	Nike Thaddeus
Kindness is my prayer. Humanity is my abode.	Debasish Mridha
Reading is a beautiful prayer for knowledge.	Debasish Mridha
Lord, I thank you for answering my prayers at the right time.	Lailah Gifty Akita
Prayers likewise your positive thoughts can be based on gratitude and love.	Raphael Zernoff, All That Is
In pursuit of exposing people for who we think they are, we expose ourself.	Shannon L. Alder
To love is to respect.	Mary Mihalic, Made to Make It
It's easier for me to forget you than for me to try and love you again	Dr. Karan M Pai
Abstract conversations are my favourite, for they unviel true convictions.	Parul Wadhwa, The Masquerade
Once in life always in heart	Murfi (MyMan)
I'd like to go with you, but I wanna stay home with you	Jordan Hoechlin
Sometimes, It's awesome to be childish with your partner .Otherwise you are missing out.	Dinakar Reddy
Your Life Doesn’t Need A Happily-Ever-After To Be A Damn Good Story	Goodhealthify.com
When the situation demands action, know the end of the action before you start the action	Ernest Agyemang Yeboah
I am happy to have love in my heart.	Lailah Gifty Akita
To live life as anything less than love is not to live life at all.	Jeffrey A. White
Love your life because, life is love.	Nazim Ambalath
My only journey is one within my self...My only path is one through my soul.	Pushpendra Pundhir
loneliness is a great teacher and a master test of character	Ernest Agyemang Yeboah
The world is a palace without bedsheets	Suchet chaturvedi
Do your thing, without harming anything.	Fakeer Ishavardas
Do not fall in love.....it means you have to look at someone else.	sunny-drunk
Love is one of life’s greatest pleasures, as it is one of life’s greatest perils.	Kelly J. Volpe, Unbreakable
Never wear a shoe that doesn't fits you.	Aireen Pontillo
Be present and aware of the privilege of living.	Ann Marie Frohoff
My short love story gave me lots of memories but i never wanted memories, I wanted you.	Raaz Ojha
