quote	source
If I have only one coin left in the world, I will buy a rose to propose to you.	Amit Kalantri, I Love You Too
Love was not enough to fight or I was not worth to fight.	Arzum Uzun
If sleep wasn't necessary, I would have used those 8 hours just to gaze at you.	Amit Kalantri, I Love You Too
Love was not enough to fight or i was not worth for fight.	Arzum Uzun
Men are from Mars and Women are from Venus. Where are Angels like you are from?	Amit Kalantri, I Love You Too
If sleep wasn't necessary, I would have used those 8 hours to gaze at you.	Amit Kalantri, I Love You Too
Jenny," he whispered. "My Jenny.	Amanda Gray, Endless
If you keep torturing me like this …’ Robert said.‘What will happen?’‘You don't know?	Debra Strattford, Worthless
Someone who loves you, will act as sibling rather than a lover.	Olivie Boyke
He pouted—full on pouted. A prince. Pouting. - Kara, re: Braeden	S.M. Boyce, Heritage
I'll keep you here.' He taps his temple. 'Where you can't get lost.	Gayle Forman, Just One Day
Being with her can prove difficult, but life without her would be unbearable.	J.E. Johnson
Love is just a contact of no refusal.	sol michael
Just give us until Rome.” The tears escaped. “Just give us until Rome, Melanie.	T.M.  Williams, Moonlight
Lovers look in the pants, they look in the eyes.	M.F. Moonzajer
who will love you? who will fight? and who will fall far behind?	birdy from skinny love
Lips are the fingerprints of love.	Tyler Shields
Mean wordsOnce upon a time, I loved you But I will neverI swear.	Arzum Uzun
There is nothing sexier than sword fight.	Stana Katic
Holding you close to my heart makes me feel special. In this moment, I am free to be me.	Zarina Bibi
 A woman never loves to any man, she only controls him	er.teji
If it’s the right person, it’s easy.	Nina Ardianti, Restart
When I say love, I mean love.	Sofía Navarro
They stamped their own pattern of lovers onto the fabric of Paris.	Emma Calin, Knockout!
Lovers are weapons, but love is a wound.	Lauren DeStefano, Fever
His fingers have been slowly lacing through my hair.	Colleen Hoover, Hopeless
We kind of fell into one another, not even realizing it was happening.	Ashley D. Wallis, Leaping
You wanted a wife but I wasstill a girl.	Kate Chisman
I give you," said Alexander, glancing at her, "what you need most from me.	Paulina Simons
I worry about anything happening to you ... because I truly love you, every bit of you.	Robyn Heirtzler, inDIVISIBLE
Love is tranquility in the world.	Zai
The endless thing in the world is Love.That is Beautiful.	Avinash Babu
Two is always better than one.	Missy Lyons, Alien Promise
Lust fades after climax, love lasts until breakfast!	Tom Conrad
 Love is a renewable resource	Susan Blanshard
If you love someone, be their everything.	T.A
I have not betrayed Julia.	George Orwell, 1984
Love may not expect love in return but lovers do.	Na
I am but a firefly caught in his jar and when he looks at me, I can’t help but glow.	Kellie Elmore
I may tear you apart but I'll put you back together.	Donna Schoenrock
And I swear, she tasted like the sun.	S. Gregory
I must tell you what you will not ask, though I may wish it unsaid the next moment	Jane Austen, Emma
Love is disgusting when you no longer possess yourself.	Pola Negri
Love Rocks The De La Cruz's World	P.T. Macias
Love is an involuntary gift that manifests unplanned.	Riaz Ahmed Gohar Shahi
Those who listen with their hearts will begin to see patterns everywhere.	Grace-Naomi
Memories help make us who we are.(Taken from novel...A Very English Affair)	Faith Mortimer
faith is when music stops but you continue dancing.	Rudzani Ralph
The wonderful life is lived in love.	Lailah Gifty Akita
The words on my heart are love, faith and hope.	Lailah Gifty Akita
Love is blazing fire.	Lailah Gifty Akita
Love is the divinity of life.	Lailah Gifty Akita
May love binds all mankind to live in harmony.	Lailah Gifty Akita
Either give me your hand, or end it now, and put us both out of our misery	Judith McNaught, Paradise
I'm not supposed to miss you, I'm not supposed to care	Deborah Cox
He broke my heart, and now it's raining, just to rub it in...	Alicia Keys
My heart is sair-I dare na tell,My heart is sair for Somebody.	Robert Burns
I love fictional characters...they can't break your heart.	Julia Hall
I liked this girl in my sixth grade class. I dared her to kiss me -- but she didn't!	Justin Bieber
The pain of one-sided love, of knowing that I had loved her more than she had loved me	Sierra Simone, Priest
The hardest thing to do is watch the one you love, love someone else	Poise
I love you. Let's get this over with.	Kris Kidd, Return to Sender
I carried around five tons of pain where she used to be.	C.D. Reiss, Marriage Games
Kiss me back into place and remind me why we can't be together.	A.Mostafa
No hard feelings, lover. You can't break my heart. It stopped beating a long time ago.	Dez Schwartz, Roam
Five years of love , and they only fit in such a small box.	Ana Tejano, Keep the Faith
There is nothing I can do that won’t bring me back to you.	Kamand Kojouri
But you are, you know, you were, the nearest thing to a real story to happen in my life	Renata Adler, Pitch Dark
...there are worse things than losing the girl.	Stephen King, Joyland
Maybe the entire world is in love with you and I'm the only one brave enough to admit it.	Sean Glatch, 4:41
You can't wander around and think the wandering will call them back.	David Levithan
A broken love can still last forever so long as you carry the pieces close to your heart.	B.B. Reid, Fear Us
Love Is An Act Of Valour.	Amit Abraham
Some love stories has no end, no path or no name, but they are 'love stories' too.	Ama H. Vanniarachchy
Heartbreak was a bitch.	Jenna Harte, Deadly Valentine
You want her in every quadrant like a desperate fool.	Andrew Hussie
You only love me when it's convenient for you.	Ella December
You want to know how I got these scars? I ripped every last piece of you out of my smile.	Rudy Francisco
He was the one I compared all others to.	C.J. English
It was as if we'd known each other for a thousand years.	C.J. English
We share that misfortune, reaper...	Rachel Vincent, If I Die
Our scars make us who we are. Some scars are just deeper than others.	Alex Rosa, Tryst
Have you noticed ... that he actually hadn't made any promises to you?	Janie Chang
A song that wrenches the heart finds a knowing ear and a liking heart.	Auliq Ice
What's the point of keeping in touch with the girl you're crazy about, when you're dying?	Marie Lu, Champion
I wrote too many poems in a language I did not yet know how to speak.	Andrea Gibson
If they're dumb enough to walk away be , strong enough to let them go	Various
No demigod can heal your heart."Aphrodite to Reyna, at Charleston	Rick Riordan
Love doesn't go away just because you realize you can't be with someone	Lexi Ryan, Fall to You
Today I gave you an hour. A year ago I would have given you an eternity.	Rachel Van Dyken, Elicit
I didn't fall in love with you tate, I flew..	Colleen Hoover, Ugly Love
It takes two to tango, and if you dance too long, implosion is inevitable.	Allie Burke, Paper Souls
Love is a kind of killing, Addy," she says. "Don't you know that?	Megan Abbott, Dare Me
I would cry if I could, but instead I just feel my heart rip apart.	Siobhan Davis, True Calling
A broken hand works, but not a broken heart.	Persian Proverb
Ah, merciless Love, is there any length to which you cannot force the human heart to go?	Virgil, The Aeneid
The human heart is the only thing whose worth increases the more it is broken.	Shakieb Orgunwall
I need you like the day needs the night" -Quinn O'Shea	Tammy Morea, August Moon
Without the dark we'd never see the stars.	Tammy Morea, August Moon
i promise you that i won't promise you anymore.,,,	Rahul Yadav
DANWhat do you want?ALICETo be loved.DANThat simple?ALICE It's a big want.	Patrick Marber, Closer
Honesty is nothing more than a party trick, and you know how much I love to dance.	Elizabeth Brooks
A heart never breaks in the same pattern of pieces	John Geddes
I envythe cup of coffeethat getsto kissyour sleepy lipsawakeevery cold andbitter morning.	Sade Andria Zabala
Love is only made more valuable by the risk of heartbreak.	Alessandra Torre
And you left your mark on me...With the destruction of us, finally, we became no one.	Nadège Richards, 5 Miles
Everyone who loves risks losing their heart every minute of every day.	Carolyn Haines, Bones To Pick
A jagged stone existed where her heart had been.	Meljean Brook, The Iron Duke
Whenever, I think It's Over But I find Its begin.....	Rahul R Singh
Life is like a race, whenever I found a finish line, I lose, bcoz I'm last.. :(	Rahul R Singh
I wonder if I could take back every 'I love you' ever said to you, would I do it?	Faraaz Kazi
And after that, you don't feel the same toward the other person any longer.	George Orwell, 1984
Life is all Love, unless you are with right people.	Prathmesh
There will be a time when you are forced to follow your heart away from someone you love.	Ashly Lorenzana
If I wasn't so phenomenal. I would go back to you.	Coco J. Ginger
I have nothing to offer you otherthan the undying love of my broken Heart.	Angivel of Zanarcadia
Let us embrace, and from this very moment vow an eternal misery together.	Thomas Otway, The Orphan
To measure the man, measure his heart.	Malcolm Forbes
You live out the character of he whom love is immersed in you	Sunday Adelaja
Man is a logical machine run by the scoundrels of emotions.	Raheel Farooq
For an educated person, intelligence is important but character is more important.	Debasish Mridha
Home is our greatest place of trials.	Muhammad bin Muhammad
You will know who truly loves you when you ask them to do an uncoventional favor.	Michael Bassey Johnson
A journey of 1,000 miles starts with just 10 digits.	Gayle Forman, Where She Went
No more,' I told him. 'No more running in the wrong direction... You run to me'.	Wendy Higgins, Sweet Peril
Life is a journey, so go on your way. Be a messenger of peace.	Debasish Mridha
Our life is a journey toward happiness.	Debasish Mridha
Happiness is not a destination but the journey itself.	Debasish Mridha
Men dream more about coming home than about leaving.	Paulo Coelho
Life is good. Even when it isn't. Because there's always HOPE beckoning you from ahead.	Anusha Atukorala
Oh I don't know,' he said. 'But maybe, maybe love should be a kind of journey	Anthony McDonald, Adam
Sometimes you have to try all options to find out the best one for you.!	Best-Quote
You shouldn't have to convince anyone to choose you. There is no real choice in love.	Tarryn Fisher, F*ck Love
Accept who are you and your uniqueness. Define your choices and believes.	Lailah Gifty Akita
Frankly, the only good people who I know are dogs.	Fakeer Ishavardas
You'll contact with me by the pressure, the need or by the interest ".	Fernando González y Lozano
I speak of the human heart, not a logic puzzle." -Diego de Gama	Julia DeBarrioz, Cazadora
People Always Confuse Between To become What..? or To Become Whose...?	Yaganesh Derasari
One of the best things about humans is their ability to love.	Auliq Ice
.....Her eyebrows are the living example of nature.	Farooq A. Shiekh
White emotions when fell in love turned red...-The Drenched Writer	Shonali Dey
Don’t get shitty when I treat you as you are, a casual acquaintance	Genereux Philip
Love is a wishbone cracked in two.	Mirjana M. Inalman
.......Love is physiologically a legal battle that lovers fight until death.	Farooq A. Shiekh
What you think is the heart might well be another organ.	Jeanette Winterson
...... Love is physiologically a legal battle lovers fight until death".	Farooq A. Shiekh
The wrong lover will always make your love feel inadequate.	Jasmine Sandozz
I keep hearing that love isn't a logical emotion. Should I worry about that?	Ellen Hopkins, Perfect
All negative emotion originates from FEAR and all positive emotion originates from LOVE.	Renee Cefalu
However apart, soulmates never part.	Shampa Sharma
People pay a dear price when not dealing with the powerful emotions.	David W. Earle
Over intellect will make you a genius, over emotions will make you a lunatic.	Amit Kalantri
..forever daydreaming of a kiss so sweet, angels weep..	Lenise Lee
I have never counted on someone to take care of my emotions for me.	Mary Mihalic, Made to Make It
Our atheist thoughts go out to his family following their loss.	Brian Spellman
Love has no value in the absence of truth.	C.J. Anderson
Love’s value is not dependent on the person receiving it, but on the person giving it.	Jeffrey Fry
If you want True love. Love With Who Love You	Arshdeep Singh Samrala
If you don't see your own value, don't expect others to as well.	Robert Tew
It's not the price but it's the value of the thing that making them important	Johncen-k.m.f Vergara
Happiness has no book value, but life has no value if there is no happiness.	Debasish Mridha
Be with people who know your VALUE not your PRICE	Hassan Choughari
We cherish reprobates, not for their cruelty, but for their little show of patronage.	Michael Bassey Johnson
Of what value is your life, unless you are willing to sacrifice it for those you love?	Wayne Gerard Trotman
Apathy is not compatible with love	Simon Tam
Let there be no love poems writtenUntil love can exist freely andCleanly.	Amiri Baraka
He was a serial dater, and she was a serial killer. Justice brought them together.	Natalya Vorobyova
Why must Justice have a color? Is it the same "REASON" that the sky are "BLUE?	Henry Johnson Jr
He might fight under my badge, Bet'anya, but you're the only one he would die for.	Sherrilyn Kenyon, Styxx
Justice without mercy is tyranny	E'Jéi Osborne
Mother's hug- The only drug that works every time, costs nothing and has no side effects.	Hassaan Ali
Apologize quickly when you wrong someone, because I'm sorry has no value in the grave.	Lakesha Ruise
Being a woman, I tried, I cared, I loved and blamed in return.	Priyanka Bhowmick
A full lifer doesn't commit to anyone until they've committed to her	Deanna Kizis
You'll never be able to silence the woman who was born to write.	Melody  Lee, Moon Gypsy
A woman is like an egg salad sandwich on a hot Texas day.	CheldonCooper
A woman loves purposeful commitment.	Lailah Gifty Akita
A woman who truly loves herself better loves others.	Toni Sorenson
Man's love is of man's life a thing apart,'Tis woman's whole existence.	George Gordon Byron
No matter the age, a woman who is unloved is lost - unloved she might as well die.	Coco Chanel
Love is neither a sadist nor a masochist, but a woman seeking the approval of her lover.	Billy S VanOrsdol
A woman's assets are her infectious smile and bulletproof love.	Debasish Mridha
Communication by touch is not for every old dutch.	Volodymyr Knyr
The game never changes, you must be in the secret before you are shown to the public.	Michael Bassey Johnson
Outward beauty is the frame for the masterpiece of your soul.	Shannon L. Alder
To stand a storm and get blown away by her whisper.	Saleem Sharma
Your woman should always be short of words and full of kisses.	Saleem Sharma
How does it feel being a woman's weakness? I mean a real woman. I mean a real weakness.	Sofía Navarro
Women are extraordinary creatures!	Roman Payne
Love will turn the whole world into something greater than itself.	Lauren Oliver, Delirium
A clone may be a good copy, but you are the real thing!	Anthony T. Hincks
Nothing in my life has ever felt so good, yet hurt so achingly bad.	Colleen Hoover, Maybe Someday
She’s my hero. Everything good and decent that I am is because of my mother.	Katie Ashley, Redemption Road
Love teaches a good person to do bad and a bad person to do good.	Heenashree Khandelwal
where love n happiness makes us blind, pain n hurt helps to see truth. So, pain in good.	deepakgogna
Don't cheat when you got the most beautiful woman by your side	MG
We’re animals. No shame, no guilt - no sin…	Heather McVea, Turn Darkly
You cannot give up. We are Gargoyle, and we are strong.	Faith Gibson
Love bade me welcome; yet my soul drew back,Guiltie of dust and sin.	George Herbert
If pride is a sin, then love must be the mother of sin.	Lionel Suggs
I've been in love for five hundred million years…	Italo Calvino, Cosmicomics
The evolution begins at the moment when you decided to love yourself.	Corina Abdulahm-Negura
Evolutionarily speaking, love is all about procreation.	Abhijit Naskar
Make mankind your dwelling place.	Idries Shah, The Dermis Probe
There are no such things as book hoarders, only aspiring librarians	Inafetse Santos
And I go home having lost her love. And write this book.	Jack Kerouac
A good book is a true friend who never betrays.	Debasish Mridha
In the darkness of my dark-beating heart, I know. He'd have loved it, all right.	Markus Zusak
I want and I wish a love like of books	Kat Unda
There is no better adviser than a good book.	Debasish Mridha
I am obsessed with books.I am a book collector.	Lailah Gifty Akita
Be great, read great books.	Lailah Gifty Akita
Lhe love of a book is what's in your heart	Carmela Dutra
Only a book is enough to change the course of your life.	Aman Jassal
I like two types of dust: pixie dust and dust from old, first edition books.	Nicholaa Spencer
But the book! The siren song of the book!	Ellen Douglas, Witnessing
The pages of a book are given life only as they are opened	L.J. deVet
P.S. Please give my love to Tink, she always was such a funny little bug	Jodi Lynn Anderson
Faithfulness is my promise to love you forever	S.K Logsdon
how long is forever when you can stop the time for a while to see...the sunrise?	Haidji, Life into Mist
-"you dress to impress"-"No Angel,I undress to impress	Becca Fitzpatrick Finale
Losing your love hurts more than playing with fire.	Leydi Morfa
A smile costs nothing.So don't waste it!	Anthony T. Hincks
It doesn't matter where you go in life it's who you have beside you	Jeroen Saey
Love is an inspiration. It moves you. It motivates you. It keeps you going.	Dee Dee Artner
My father couldn't warm my frozen hands.	Tahereh Mafi, Shatter Me
I don't understand, Jem. I don't understand why you'd leave me. Why would you that?	Rachel Ward, Numbers
Where do we go from here?"-Kiera"We go nowhere."-Denny	S.C. Stephens, Thoughtless
Sticks and stones may break your bones but words can break hearts.	Tim Minchin
Love always hurts, Always. It’s what you do with it that makes it durable.	Athena Kamalei
More disturbing than hurt is love when it's wrong.	Ali Land, Good Me, Bad Me
When you truly love, you can never really get hurt.	Jeffrey Fry
There is a hole in the heart called "absence". You live in it my dear.	Malak El Halabi
I never had any problem with my heart, till I met you!	Shadi Kamal Kandil
My deservedness is more than your expectation.	Sushil pandey
Don't win someone you're willing to lose	Stefanie Sta. Maria
Sometimes, we want what we want. Even if we know it's going to kill us.	Trevor Driggers
Feeling hurt and not being able to recover is a consequence of 'Love until it hurts'.	Rohan B Rebello
When he opens his mouth to speak, I place a finger on his	A.G. Howard, Ensnared
Love and betrayal comes hand in hand.	Ama H. Vanniarachchy
An Abyss is a deep and terrible chasm. What’s a chasm? A deep gash in the rocks.	Diane Samuels
I didn't know where it would lead. I wanted things to develop naturally.	Earl Lovelace
Take out the garbage...true happiness comes from within not from without!	Ken Poirot
To stop being a victim, you have to stop thinking like a victim.	Asma Naqi
I don’t know if he’ll even look at me, because I can barely look at myself.	Gail McHugh, Pulse
my enemies don't scared me .. but the people who say I love you	Mohammed Zaki Ansari
So, what should I do right now?Stop crying, open your heart, and pray.	Sintia Astarina, Taman Pasir
Respond with love even when someone wants to hurt you.	Debasish Mridha
Cry For Those Who Cares For You And Not For Them Those Who Makes You Cry	Jay Patel
I cared her, I adored her, I loved her a lot, But in the End it didn't matter at all..!!	shady_N
Lines are drawn, but then they fade. For her I bend, for you I break.	Colleen Hoover, Maybe Someday
There is no burden in love, because love is always selfish	Novellina A., Fantasy
Because I love him so much and it hurts	Novellina A., Fantasy
it's hurt but I love you I'm strong	anirka witri
It hurts because there is no alternative to Love.	Himanshu Chhabra
So love is about finding the right person to hurt you?”“Pretty much.	Matt Haig, The Humans
I always knew death of this relation would be the death of my life.	M. Ali
its better to get hurt now than to get hurt later.	Mohammed Suleman Khan
The feeling of being hurt, is the proof that you are in love.	Ahmed Ayub
A love you always have to fight for isn't worth it	Yuuki Obata
Even though your words hurt the most, I still want to hear them everyday.	Andrew Davie
If you really want to hurt, find someone who loves you.	C.J. Langenhoven
Sometimes you have to forgive the process, knowing that the outcome is for the best.	Beth Ciotta, Jinxed
As long as it still hurts, it isn’t love yet.	Silvia Hartmann
Humility and pride will forever battle whenever or wherever love is concerned	Jeremy Aldana
Love the life you have been given. And be humbled by it. It is not to be despised.	G. Willow Wilson
You must love yourself first to the soul of your aura...	Jennifer Pierre
There is a humility about genuine love that is rather horrible in some ways.	George Orwell
Imitate Jesus and Socrates	Benjamin Franklin
Love manifests itself in loving attitudes and acts	Sunday Adelaja
Someone who does not practice what he preaches expresses only hypocrisy.	D.S. Mixell
Find yourself, and once you do never let go	Coach Cassandra
Gratitude is the language of love.	Clifton L. West III
Just remember to say THANK YOU sometimes, for all of these everyday extraordinary gifts.	Scott Stabile
It's a nice feeling, Knowing, Someone lived easier Because I was alive.	Nikki Rowe
We do not owe any soul, except that which played the most vital role in our lives.	Michael Bassey Johnson
My arms would be wrapped around him like angels’ wings.	Jess C. Scott, Playmates
Tell your story to the universe and Let your actions speak LOVE.' No matter what it is.	Napz Cherub Pellazo
Not everything is a love story.	Ale Meza-Santiago
Optimism is a belief and I adapt belief as a way of life.	Fe-en-Dios
Don't bring me the stars from the sky,I'm planting sunshine in my backyard.	Sanhita Baruah
Learn how to love a broke man to marry a good man.	Amen Muffler
In order to deceive others, you must first deceive yourself.	Efrat Cybulkiewicz
Self Love is about seeing yourself through your own eyes.	Jasz Gill
I would love to be loved for what I am, and not for what I have!	Nehali Lalwani
Love is to love, be loved, and lost.Never to be enclosed in mortal hands.	Vinod Varghese Antony
Love is greater than the oceans with full of passions.	Vinod Varghese Antony
Blessed is the heart that does not collect resentments and often dwells on them.	Swami Ranganathananda
life is short,before one can catch up with this ,time would ring the bell-hey-day is off	litymunshi
i closed my eyes and i loved you ... dreams are such beautiful things	rassool jibraeel snyman
If you take it step by step, you shall least miss a step!	Ernest Agyemang Yeboah
There is no Success or Failure in "LOVE", by itself is a Victory !!	Mahesh shekhar
Some people are like the fragrance of flowers!	Avijeet Das
Cliche is Truth's most loyal friend...	Rafael  Reyes
You were the devil. Dressed in everything. I wanted.	R H Sin
These poems are cupsthat I pour my love into.Here, Drink!	Kamand Kojouri
She is the light,at the end of this endless tunnel.	Vivid Darkness
No misery ever so beautiful than the one this mind creates.	Vivid Darkness
You burn like a candleinside my soul,showing me a waythrough this darkness.	Vivid Darkness
Drink in the moon as though you might die of thirst.	Sanober  Khan
love is always moving towards you	Sondra Faye, Play Infinity
Your smile is poetry to my soul igniting flames of old	Micheline Jean Louis
the sapphire depthof my own love...startlesand warmsand wounds my soul.	Sanober  Khan
someday i will walk under the soul-blossom tree with my hand eternally woven in yours.	Sanober  Khan
when i write of you, my deari am holding youin the most exquisiteways.	Sanober  Khan
A poem in the heart is worthmore than a million dollarsin the bank account.	Sanober  Khan
sometimes i am not sure.if i am writing the poemor the poemis writing me.	Sanober  Khan
You were, arecactus tourism. meeting you: granularfractals borrowed from oceans.	Virginia Petrucci
Purity is defined by the clearness of the stars	Michael Biondi
Beauty Lies Within The unknown	Michael Biondi
Life is beautiful. Death is astonishing.And love is the just breaths taken in between	Michael Biondi
Writing and art are my lovers	Edna Stewart
Love crosses the sky \ on a peculiar disturbing night.	Shannon A. Thompson
... this longing inside me that never goes away, must be a poem...must be you ...	John Geddes, A Familiar Rain
You Know love when you see it, hear it, and feel it." ~ Amunhotep El Bey	Amunhotep El Bey
And I was even beginning to think home might be with you.	Ben Sherwood
Life takes us to unexpected places... love brings us home.	Unknown Author 770
HOME, which is the last floor for everyone.	Sushil Singh
Every time I converse with you, I feel closer to home	Evy Michaels
Make your habits your beloved home.	Debasish Mridha
Sometimes, all it takes is one arm wrap-round. And a heart’s home.	Alyse M. Gardner, Slayers
