quote	source
If ever any beauty I did see,Which I desired, and got, 'twas but a dream of thee.	John Donne
Without Love, you can't know yourself.	Reuben Berger
Beauty, love with truth, that is all there is.	Lailah Gifty Akita
It takes my breath away!" that's all that I can say.	Anthony T. Hincks
This moment is all there is and LOVE is like the glue that keeps you in it.	Reuben Berger
A smile is what makes a face beautiful.	Anthony T. Hincks
Only when I quit lying to myself did I discover the real beauty of my truth.	Scott Stabile
You were born beautiful, and you remain beautiful.	Scott Stabile
Always carry what is beautiful in your heart.	Will Advise
The fact that neither of us made sense was the beauty of it.	Dominic Riccitello
There is beauty in tragedy. And we all believed!	J. Limbu
You can't tell what's in a person's heart until you truly Know them.	Belle
Until you see beauty everywhere, in every face, until then, you are blind.	Kamand Kojouri
She's like the rarest of jewels, too precious to be worn, and too valuable to tarnish.	Kierra C.T. Banks
What is the beauty of a thing if others do not take pleasure in it.	Gerald Mills
Love elevates the beauty of life	Farshad Asl
Love elevates the beauty of life.	Farshad Asl
Vulnerability has to happen for love to be real.	Pam Godwin, Disclaim
Open your heart to the wonder of life simply by opening your heart.	Toni Sorenson
When your heart, mind and soul is in harmony - you walk with love, you walk with beauty.	Angie karan
Beauty will attract a man, but more than it will help you to keep him.	Olawale Daniel
Beauty is all around you. To find it, you need love filled eyes to search for it.	Debasish Mridha
What is worse losing love or never finding it at all?	Vanshika Dhyani
What is beautiful?Everything that has been loved by someone,That is beautiful.	Newpostcard
Sometimes it's hard to look at a flower, when your dying inside.	Anthony Liccione
If you want to see beauty, look with love and appreciation and you will find it.	Debasish Mridha
Stop looking back when your future is ahead of you	Ricky Maye
Be charming at any age.	Lailah Gifty Akita
A right fair mark, fair coz, is soonest hit.	William Shakespeare
Beauty is light set free.	A.D. Posey
The beauty in the heart is the beauty of body, soul and spirit.	Lailah Gifty Akita
Not your appearance, but your humility and power of love define your beauty.	Debasish Mridha
Love brings passionate patience to create a wonderful world of beauty and magnificence.	Debasish Mridha
Believe so brightly that everyone sees the beauty in believing.	A.D. Posey
Beauty is a heart with wings.	A.D. Posey
Beauty is the manifestation of love.	Kamand Kojouri
Like nature, we must grow with tranquility, beauty, harmony, and love.	Debasish Mridha
To see the beauty, love	Debasish Mridha
The majestic mountain is swimming in the eternal lake of beauty, love, and tranquility.	Debasish Mridha
Without love, life is empty and has no beauty.	Debasish Mridha
I belong to love the world and its endless beauty.	Debasish Mridha
Be what you are and sing a song of beauty and love.	Debasish Mridha
It is true love that can activate the beauty and power of true genius.	Debasish Mridha
To enjoy the song of love and beauty, just get lost in the wonders of nature.	Debasish Mridha
We have eyes to see beauty and a heart to love and appreciate it.	Debasish Mridha
Believe that you are unique with infinite love and beauty in your soul.	Debasish Mridha
Every new friend is a fresh flower with endless beauty, love, and joy.	Debasish Mridha
Let your life be a vivacious poetry of love, compassion, kindness, and beauty.	Debasish Mridha
Beauty is in the reflection of your love that is always present in your heart.	Debasish Mridha
You are most beautiful when your heart is full of love and your mind is soft and kind.	Debasish Mridha
To see beauty, you have to love.	Debasish Mridha
Together, we form a necessary paradox; not a senseless contradiction.	Criss Jami, Healology
Love is the beauty, the flower, the fragrance, and the attractive force of our soul.	Debasish Mridha
Always find the opportunity to express and enjoy the beauty of love.	Debasish Mridha
The measure of a Christian is not in the height of his grasp but in the depth of his love	Clarence Jordan
What a mess you’ve made of the simplest of subjects, Della.	Kellyn Roth, Flowers
Be good to the people on your way up the ladder cause you'll ,meet them on your way down.	Robert Junior
There's no way to be a Christian at home by yourself.	Sara Miles
Forgiveness brings healing.	Lailah Gifty Akita
If life is a journey then let my soul travel and share your pain.	Santosh Kalwar
This look of thine will hurl my soul from heaven.	William Shakespeare, Othello
It's not worth losing your soul to win a guy.	Daniel Nayeri, Another Faust
The heart of an Irishman is nothing but his imagination	George Bernard Shaw
Sometimes it takes great suffering to pierce the soul and open it up to greatness	Jocelyn  Murray
I believe that the measure of my soul is my capacity to love imperfect people.	Joseph Grenny
I'm your other half. (...) I'll carry your heartbeat in mine.	Jessica Verday, The Haunted
Bella. You were always my soul.	Lora Leigh, Wild Card
When soul risesInto lipsYou feel the kiss You have wanted	Jalaluddin Rumi
She has one hell of a dark soul,but damn,it’s so full of light!	Melody  Lee, Moon Gypsy
Nourish the body, nourish the soul. Punish the body, punish the soul.	M.L. Shanahan
She has wings the color of wild and a soul the color of art.	Melody  Lee, Moon Gypsy
I am a wildflower in your perfect bed of roses.	Melody  Lee, Moon Gypsy
Light is the spirit of love.	Lailah Gifty Akita
You put butterflies back into my soul and painted their wings with passion and poetry.	Melody  Lee
I'm a tangled mess of wild.	Melody  Lee, Moon Gypsy
The romantic within us is a harbinger of our deepest desires.	Craig D. Lounsbrough
I didn't survivethe storm outsideto allow anyone (including myself)to erode my soul	Vijaya Gowrisankar
The only love originates from the light in the soul.	Lailah Gifty Akita
Love is the divinity of two souls in oneness of spirit!	Lailah Gifty Akita
When someone starts topic 'True love'Automatically My soul missing you..!!	Vaishal sheth
By loving you, I learn everything because your soul contains the entire universe.	Kamand Kojouri
Don't neglect yourself as your soul longs to be accepted and loved by you.	LatikaTeotia
His soul was swimming in the maelstrom to keep her swim in the peaceful end!" ~ AB	Ashish Bhardwaj
He stirred my soul in the most subtle way and the story between us wrote itself.	Nikki Rowe
Let your Life be a garden of peace and your smile be a bloom of flowers.	Dinakar Phillip
his eyes are swords from far was sparkling sharpnesson my body and soul	litymunshi
Our souls fell in love long before we ever knew.	N.R.Hart
You have been the pillowI lay my weary soul upon	Richard L.  Ratliff
You and IThe starry sky Dancing in the night Talking all things life.	Nikki Rowe
She never allowed the external world to change her soul, that was her magic.	Nikki Rowe
I see him in my mind's eye, feel him in my soul...twin flames will unite.	Sanjo Jendayi
Our soul is an instrument of music if we choose to play it with love!	Sima Mittal
It is beautiful to hear, how even the demons inside me have started singing your name.	Akshay Vasu
This could be no mercy on my soul if someones destroy my heart.	Kurt Reiner Suarez
if somebody ask me to chose my home in the whole world i would chose your arms	pooja bagul
Written soul is called poetry	Munia Khan
Old soul cries through the tears of a newborn	Munia Khan
Music is what our soul sounds like when it sings.	Xila Toro
I have learned that only the dead have a steady state of mind.	Abeer Allan
Do you think your soul is more beautiful than your body?	Tamara Stamenkovic
Life's too short to lay in wait. A soul is meant to love and love is all there is.	Kate McGahan
The soul of Dr. Mrs. Lailah Gifty Akita is the spirit of light and love.	Lailah Gifty Akita
The spirit of light is the soul of love.	Lailah Gifty Akita
I lost a lot of people when I found myself.	Nikki Rowe
I need to hold on to the faded love ‘cause I love to secure the stems of dying flowers	Munia Khan
i trust our connection, regardless of what logic has to say.	Nikki Rowe
He's the reason I am strong but he is also my biggest weakness.	Nikki Rowe
Your words don't match your vibe, & im trusting my gut this time.	Nikki Rowe
He had become enveloped in the Indian Summer of the Soul.	O. Henry
If your heart is conflicted, teach it to be unrestricted.	Nikki Rowe
Love is a sacred soul.	Lailah Gifty Akita
Seeked of self love.	Nikki Rowe
Don't suffocate your spirit for the lessons that were only passing through spring.	Nikki Rowe
Be a loving soul.	Lailah Gifty Akita
If you find your sacred soul, bind the love bond.	Lailah Gifty Akita
That which is cool is driven by the soul.	A.D. Posey
You have been missing from me for far too long.	Belle Hale, Soul Imprint
When in love, every soul becomes a poet.	Lailah Gifty Akita
Search deeply in your soul, you will find love, peace and joy.	Lailah Gifty Akita
Love is in your heart. If you search deeply you will find it.	Lailah Gifty Akita
Walk the path your heart beats faster on.	Nikki Rowe
Love is the strength of my soul.	Lailah Gifty Akita
Love is a spiritual soul.	Lailah Gifty Akita
Love is the strongest soul.	Lailah Gifty Akita
I love my soul to spiritually care for it.	Lailah Gifty Akita
Love ignites spiritual fire in the soul.	Lailah Gifty Akita
Our hearts speak the same language but more importantly our souls share the same voice.	Nikki Rowe
Her words are her wings. She's flying.	A.D. Posey
Every day is not a day to master but an adventure to experience.	A.D. Posey
Be still in peace and reach your highest peak.	A.D. Posey
Life is magic.	A.D. Posey
Kind words change the world.	A.D. Posey
Film gives us a second chance at a first impression.	A.D. Posey
May your soul be rooted in love.	Lailah Gifty Akita
The best writing speaks when the heart whispers.	A.D. Posey
Drizzle happiness wherever you go.	A.D. Posey
There is love in every soul.	Lailah Gifty Akita
If you are not more alive when in love then you my friend are in love with the wrong one.	Nikki Rowe
Crying cleanses the soul.	A.D. Posey
Love protects and preserves the soul, spirit and the body.	Lailah Gifty Akita
Love is the mighty force of mind, soul and body.	Lailah Gifty Akita
Do not forget to explore your soul.	Lailah Gifty Akita
Love set the soul on spiritual fire.	Lailah Gifty Akita
I am a great soul.	Lailah Gifty Akita
If you do everything with love and joy, you will find your soul.	Lailah Gifty Akita
Music is the song of eternal love which touches the soul and fills us with joy.	Debasish Mridha
We hold on to poetry because it lights a fire in our soul and keeps our bodies warm.	Sanober  Khan
My soul.My spirit.My strength.	Lailah Gifty Akita
Every damaged soul deserves the chance to love again.	Virginia Alison
Life is a dancing mind, loving heart, caring soul, and wandering thoughts.	Debasish Mridha
Its not easy to Love someone, it makes your heart addicted and your soul craving !!	Dinakar Phillip
When love and duty are one then grace is within your soul.	Shannon L. Alder
Love with your soul. Hear your soul speaking, it will always be your guiding light.	Nikita Dudani
You don't need an entire garden bed, to notice the beauty of a flower.	Nikki Rowe
A vibrant body, a radiant mind, a loving heart, and an honorable life.	Stefan Emunds
You're like a gem shining ever brightly in an ever dimming world.	Zechariah Barrett
They say this soul hunting will cost me my sanity,i say i'd go insane if i stop.	Anjum Choudhary
I define my life not by the things I have done, but by the people I have loved.	John Paul Warren
the quality of your mind depends on the quality of your thought	okorie deborah
How to uplift others. It’s not a pie, it’s a cake. It’s not a ladder, it’s a bridge.	Richie Norton
Entitlement is such a cancer, because it is void of gratitude.	Adam Kirk Smith
To the degree you experience a love deficit you will also manifest a leadership deficit.	Glenn C. Stewart
Loving leaders allow for individuality in style and expression.	Glenn C. Stewart
To be a real leader, serve with love.	Debasish Mridha
In the end, every startup is different. But in the beginning every startup is the same.	Richie Norton
i am a museum full of artbut you had your eyes shut	Rupi Kaur, Milk and Honey
Is love an art? Then it requires knowledge and effort.	Erich Fromm
I thought clay must feel happy in the good potter's hand.	Janet Fitch, White Oleander
In the arts, as in life, everything is possible provided it is based on love.	Marc Chagall
You were born an original work of art. Stay original.	Suzy Kassem
Love is an art and this love lacks artists.	Javaria Waseem, You and Her
Look within - there is no end!	Malebo Sephodi
I am art. I am authentic. I am love. I am me.	Malebo Sephodi
To fall in love with pain is to fall in love with art.	Dominic Riccitello
Art fuels the fire inside me.	Efrat Cybulkiewicz
Art is love made public.	Hernando Fuentes
The boy took my sketchbook.	Ashley Earley, Alone in Paris
How lucky I am to lose sleep over such a work of art.	Taylor Patton
You'll live through my words and my pictures, and I'll live somewhere the skies are blue.	Maria Elena, Eternal Youth
Art contained an undefined mystery that spoke to her soul.	Geraldine Solon, The Portrait
A heart favours love, a head favours work, a heart and head both favours hobby.	Amit Kalantri
People can lose their lives in libraries. They ought to be warned.	Saul Bellow
That I can read and be happy while I am reading, is a great blessing.	Anthony Trollope
My early and invincible love of reading--I would not exchange for the treasures of India.	Edward Gibbon
Books are best preserved in the minds of readers.	Kat Lowe, Dream Cat
If you read, you shall renew your mind.	Lailah Gifty Akita
Some read to learn, some to laugh, and some to live.	Joyce Rachelle
Between the pages of a book is a lovely place to be	Unknown
I am going to build a fortress of books.Will you come inside and live with me?	Kamand Kojouri
I just want to read and ignore all my adult problems.	Unknown
How can I survive without a book to read?	David Hill
Reading brings us unknown friends.” — Honoré de Balzac	Susan Parker Rosen
Dare to read.	Lailah Gifty Akita
The joy of reading is sacred pleasure.	Lailah Gifty Akita
Greatest companion is found in reading great books.	Lailah Gifty Akita
The greatest treasures are books.	Lailah Gifty Akita
The best gift, you can give me is a book.	Lailah Gifty Akita
Where there is no love, put love -- and you will find love.	San Juan de la Cruz
Spread the light of love in the spirit of purity of the soul.	Lailah Gifty Akita
I can't talk, or I will throw up!	William Shakespeare
True love is deep spiritual affection.	Lailah Gifty Akita
Deep spiritual affection is divinity of two souls but oneness in spirit.	Lailah Gifty Akita
Eternal love’ (sanatan sneha) is indeed moksha [ultimate liberation].	Dada Bhagwan
The fruit of worldly love is indeed revenge (vengeance).	Dada Bhagwan
Your choice can either violate a spiritual principle of love or walk in it	Sunday Adelaja
The love of a half dead heart will keep you half alive	Munia Khan
The bliss of love is wonder.	Lailah Gifty Akita
The realms of love and light, anything is possible	Lailah Gifty Akita
If you find your sacred soul mate, bind the love bond.	Lailah Gifty Akita
I fly on the wings of love.	Lailah Gifty Akita
Love is force of being.	Lailah Gifty Akita
Love is beyond the physical.	Lailah Gifty Akita
My love for you attains immortality whenever it is touched by the thought of death	Munia Khan
Love is the spirit of light.	Lailah Gifty Akita
Love is ignites the light in the spirit	Lailah Gifty Akita
Fake is the new real,You gotta keep a lot a shit to yourself.	Genereux Philip
If an Artist falls in love with you, you will live forever.	Genereux Philip
Don't fuckin' sleep on yourself	Genereux Philip
Profound thinkers either become astute lovers or rebellious spirit	Ramana Pemmaraju
BLACK IS SO FUCKIN' BEAUTIFUL	Genereux Philip
We didn't do anything illegal, All we ever did was be black.. #BlackLivesMatter	Genereux Philip
These Hoes Just Gon Fuck Who Ever Poppin , You Better Be Careful, When you fuck em' Raw!	Genereux Philip
It is spring again, my heart is dancing with flowers with love and joy.	Debasish Mridha
Not the reality, but your thoughts define your destiny.	Debasish Mridha
To be happy, learn to forget and forgive.	Debasish Mridha
Win hatred with love, enemies with friendship, and cruelty with kindness.	Debasish Mridha
Persistence with hope has infinite power, it can create new ways when there is no way.	Debasish Mridha
Hope has magic in it, it can create a door when there is none.	Debasish Mridha
Every moment is a moment of hope, moment of beauty, a moment of joy and it is our life.	Debasish Mridha
The only journey worth taking is the spiritual journey within.	Debasish Mridha
When you try to make others happy, happiness will follow you like your shadow forever.	Debasish Mridha
Today is the most beautiful day to begin the rest of your joyful life.	Debasish Mridha
To avoid the pain of loss, give up attachment.	Debasish Mridha
He is the best friend who can see and reveal to you what is the best in you.	Debasish Mridha
Make inner peace your final destination. Make happiness your life's purpose.	Debasish Mridha
Be a thinker, be a dreamer, be a believer, be a doer, and, above all, be a kind lover.	Debasish Mridha
Wherever you are, smile with love like a flower.	Debasish Mridha
Knowing what you don't know is the beginning of wisdom.	Debasish Mridha
Don't try to hurt anyone, you will not succeed because you can hurt only yourself.	Debasish Mridha
Dare to feel the joy of life even in the midst of misery.	Debasish Mridha
Don't seek permission to be happy.	Debasish Mridha
Our knowledge has limitations even though we have infinite imaginations.	Debasish Mridha
Most fools think he is the wisest person but the most wise person thinks he is a fool.	Debasish Mridha
The most important condition for progress is freedom of the mind.	Debasish Mridha
Knowledge is always there but wisdom is very rare.	Debasish Mridha
It is not that I am very intelligent, but I try to understand with love.	Debasish Mridha
The desire to win a war is expensive, but the desire to win with wisdom is wise.	Debasish Mridha
Wisdom is stronger than steel. It can break and it can heal.	Debasish Mridha
In the darkness, don't doubt, blame or cry. Be the light to enlighten the whole sky.	Debasish Mridha
Fear is the killer of a great future life.	Debasish Mridha
It is almost always better to listen and understand than express opinions to annoy.	Debasish Mridha
Love yourself first to be loving and beloved.	Debasish Mridha
No one can steal your love, joy, and happiness without your permission.	Debasish Mridha
Don't settle for ordinary. Dare to live a magical life.	Debasish Mridha
Your fashion should reflect your true passion for life.	Debasish Mridha
We are never free when we imprison ourselves in the prison of our fixed, false beliefs.	Debasish Mridha
If life is a flower, then love is the beauty of that flower.	Debasish Mridha
Love gives us the perfect, pure, and sweetest joy of life.	Debasish Mridha
As sunlight is for flowers, so is love for life.	Debasish Mridha
Being in love with yourself will teach how to love others.	Debasish Mridha
Speak with your heart when you speak love.	Debasish Mridha
Love is not an option, it is the only option.	Debasish Mridha
Love has no monetary value, but without love, life has no value.	Debasish Mridha
What you expect, it will happen.	Debasish Mridha
True fashion should reflect deeper feelings of inner passion for life.	Debasish Mridha
Persistence is the fundamental ingredient of true success.	Debasish Mridha
We have to be honest to ourselves to see honesty in others.	Debasish Mridha
Love is deepest driving passion of a purposeful life.	Debasish Mridha
Love is the most likable, invisible fashion of life that you can wear with passion.	Debasish Mridha
Motion is the sign of life. Stagnation is the prerequisite of death.	Debasish Mridha
True wisdom reveals itself by loving everyone.	Debasish Mridha
True wisdom can never find fault or a person at fault.	Debasish Mridha
When we see things through our fixed, false beliefs, science becomes superstition.	Debasish Mridha
Love is the best invisible net to catch hearts.	Debasish Mridha
Adventure is a way of worthy life.	Debasish Mridha
You're my story,you're my poetry,you're my floweryou're my deep driving desire.	Debasish Mridha
Be at your best and be patient.	Debasish Mridha
You have to lose something to gain anything.	Debasish Mridha
Wisdom and love never decrease by being shared.	Debasish Mridha
Let us love and let it be the purpose of our life.	Debasish Mridha
To expand our life, be loving and kind.	Debasish Mridha
Fear of the unknown and resentment bring stress.	Debasish Mridha
The earth is my home, the journey is my destination.	Debasish Mridha
Life is finite, so focus on your purpose and do what is important.	Debasish Mridha
Feel the joy and love anyway, stress will melt away.	Debasish Mridha
Anxiety and stress derive from fear and self-doubt.	Debasish Mridha
You can buy knowledge but not wisdom.	Debasish Mridha
Concentrate on what is important, not what is urgent.	Debasish Mridha
Burn, burn, burn to become the light,to enlighten the whole world.	Debasish Mridha
Enjoy the love and beauty of life. It is the greatest success of life.	Debasish Mridha
Let life go with love and joy.	Debasish Mridha
Fill your life with love and then enjoy.	Debasish Mridha
Life is a mirror of our mind and it reflects the beauty of our thoughts.	Debasish Mridha
You're your best friend and worst enemy.	Debasish Mridha
To enjoy the beauty of life, live in the moment, not in the past or future.	Debasish Mridha
Do more than expected, promise less than you can keep.	Debasish Mridha
Life is finite but you're blessed with infinite love.	Debasish Mridha
Measure your life not by its duration, but by its contribution.	Debasish Mridha
Stress is a false perception of fear of the unknown.	Debasish Mridha
A journey is the way to see and feel the diversity of humanity.	Debasish Mridha
To know the world, know yourself.	Debasish Mridha
To be happy, be the cause of happiness for others.	Debasish Mridha
When stress is the disease, then forgiveness and laughter are the medicine.	Debasish Mridha
Stress steals the beauty from life.	Debasish Mridha
How beautiful it is to be stress free and bloom slowly like a flower.	Debasish Mridha
To be a success, let go of the past and accept the beauty of change.	Debasish Mridha
If you play with dirt, no matter if you win or lose, either way you will get dirty.	Debasish Mridha
Let it go to let it be.	Debasish Mridha
Power of softness and kindness are the greatest.	Debasish Mridha
Be different. Trust yourself. Be bold.	Debasish Mridha
Begin the journey. The whole world is waiting to help you.	Debasish Mridha
When you have nothing to lose you become the owner of everything.	Debasish Mridha
Where there are no changes there is no life. A plant has to change to bloom.	Debasish Mridha
If you're under stress, your life is complex. Simplify your life to reduce the stress.	Debasish Mridha
Let us say goodbye to winter to welcome the beauty of spring.	Debasish Mridha
Just be yourself to change everything.	Debasish Mridha
Control your thoughts to define your life.	Debasish Mridha
What you love is longing for you.	Debasish Mridha
When you do things with love,it is a song of your heart.	Debasish Mridha
Act as if there is no chance of failure.	Debasish Mridha
Be confident. Don't seek permission to be yourself.	Debasish Mridha
The best things to hold on to are the memories of friendship and love.	Debasish Mridha
Love heals the soul and cures the mind.	Debasish Mridha
Why are you walking alonewhen love is walking along?	Debasish Mridha
Where there is a strong desire and profound hope, there is a way.	Debasish Mridha
Everything humanity have achieved is achieved by dreams, desires, and actions.	Debasish Mridha
You're the way, you are the light. Let's go to illuminate the world.	Debasish Mridha
You are a fountain of love and a thunder of beauty.	Debasish Mridha
Before you give up, let the hope shine again.	Debasish Mridha
Love is my love, power, strength, wealth, and purpose.	Debasish Mridha
An art is a poetry but only a few can read it.	Debasish Mridha
Only the light from your heart can see the beauty of magnificent morn.	Debasish Mridha
Beauty is the wilderness of sensual perception where we always want to get lost.	Debasish Mridha
Beauty is the reflection of a loving heart, not the quality of an object or subject.	Debasish Mridha
Enthusiasm is the key but action opens the door.	Debasish Mridha
A loving heart is always young.	Debasish Mridha
Your mind is a mirror and you see yourself in it again and again.	Debasish Mridha
Confidence is good, but confidence with humility is far better.	Debasish Mridha
Your mind is the most powerful magnet. What you think, you attract.	Debasish Mridha
Let it be simple, let it be with love.	Debasish Mridha
To be a success, be yourself.	Debasish Mridha
Compassion brings us closer to each other.	Debasish Mridha
Let us love and respect each other as a friend, not stranger.	Debasish Mridha
Excellence is not a history, but a habit.	Debasish Mridha
A friend is he who can feel you, adore you, understand you, and never leave you.	Debasish Mridha
